{
  "source_id": "source-1106",
  "pipeline_version": "distillation-v1",
  "source_hash_sha256": "6468601a7460e77f6213aa18c3523700bfe0718d9531435b7831b9127db07aaa",
  "source_format": "txt",
  "encoding": "gb18030",
  "title_key_hmac_sha256": "2406df8ebed26f1adb3da8f4c852eb0ebb95f8cde9cfd0f739ab1ac275d57ce7",
  "title_signal_source": "file_stem",
  "has_author_metadata": false,
  "language": null,
  "rights_status": "user_supplied_for_analysis",
  "redaction_policy": {
    "store_source_title_in_repo": false,
    "store_author_in_repo": false,
    "store_raw_text_in_repo": false
  },
  "dedupe": {
    "strategy": "private-title-key-hmac",
    "duplicate_of": null
  },
  "parse_profile": {
    "chapter_count": 824,
    "volume_count": 1,
    "average_chapter_chars": 2314,
    "boundary_types": [
      "chinese_chapter_heading"
    ],
    "parser_warnings": []
  }
}
