{
  "source_id": "source-1154",
  "pipeline_version": "distillation-v1",
  "source_hash_sha256": "16446f88ad1f73801a7a43ae1bbacdef14c0f593cd6374b6403e53f308413bbe",
  "source_format": "txt",
  "encoding": "gb18030",
  "title_key_hmac_sha256": "ad36d6a2aeb9a3eb1244f098bad2aacbad908a0a64927a9c7b70c099e7b650b9",
  "title_signal_source": "file_stem",
  "has_author_metadata": false,
  "language": null,
  "rights_status": "user_supplied_for_analysis",
  "redaction_policy": {
    "store_source_title_in_repo": false,
    "store_author_in_repo": false,
    "store_raw_text_in_repo": false
  },
  "dedupe": {
    "strategy": "private-title-key-hmac",
    "duplicate_of": null
  },
  "parse_profile": {
    "chapter_count": 146,
    "volume_count": 1,
    "average_chapter_chars": 23693,
    "boundary_types": [
      "chinese_chapter_heading"
    ],
    "parser_warnings": []
  }
}
