{
  "source_id": "source-1010",
  "pipeline_version": "distillation-v1",
  "source_hash_sha256": "036bbb0c0e4326374eb7c369863374ef819eb8a8a3b5e58423965afd71a743a3",
  "source_format": "txt",
  "encoding": "gb18030",
  "title_key_hmac_sha256": "a47963b8878d11b74dc248937f045cb27bff4cacf1cc6f4f7dc548e8d4e9b618",
  "title_signal_source": "file_stem",
  "has_author_metadata": false,
  "language": null,
  "rights_status": "user_supplied_for_analysis",
  "redaction_policy": {
    "store_source_title_in_repo": false,
    "store_author_in_repo": false,
    "store_raw_text_in_repo": false
  },
  "dedupe": {
    "strategy": "private-title-key-hmac",
    "duplicate_of": null
  },
  "parse_profile": {
    "chapter_count": 281,
    "volume_count": 1,
    "average_chapter_chars": 6606,
    "boundary_types": [
      "fixed_size_fallback"
    ],
    "parser_warnings": [
      "No chapter headings matched; fell back to fixed-size anonymous chunks."
    ]
  }
}
