{
  "source_id": "source-0803",
  "pipeline_version": "distillation-v1",
  "source_hash_sha256": "65d4d23492657fa4b1ab2fa5e8622886b1fb5907b16051a138c08f4046572d6b",
  "source_format": "txt",
  "encoding": "gb18030",
  "title_key_hmac_sha256": "f3c31293e52bf4d1290be3c1b4534f1a3d50b3c82874e0bfacbf700c8605ea3b",
  "title_signal_source": "file_stem",
  "has_author_metadata": false,
  "language": null,
  "rights_status": "user_supplied_for_analysis",
  "redaction_policy": {
    "store_source_title_in_repo": false,
    "store_author_in_repo": false,
    "store_raw_text_in_repo": false
  },
  "dedupe": {
    "strategy": "private-title-key-hmac",
    "duplicate_of": null
  },
  "parse_profile": {
    "chapter_count": 3,
    "volume_count": 1,
    "average_chapter_chars": 566350,
    "boundary_types": [
      "chinese_chapter_heading"
    ],
    "parser_warnings": []
  }
}
