{
  "source_id": "source-0831",
  "pipeline_version": "distillation-v1",
  "source_hash_sha256": "76ac5809ca83159de0fe98f459915a803ac7ab832f2ec352d5130ece08f8c3bf",
  "source_format": "txt",
  "encoding": "utf-8",
  "title_key_hmac_sha256": "8b10099205660cd47186b3020acf9b153bfd3a70081645a2ee379d00780f4e72",
  "title_signal_source": "file_stem",
  "has_author_metadata": false,
  "language": null,
  "rights_status": "user_supplied_for_analysis",
  "redaction_policy": {
    "store_source_title_in_repo": false,
    "store_author_in_repo": false,
    "store_raw_text_in_repo": false
  },
  "dedupe": {
    "strategy": "private-title-key-hmac",
    "duplicate_of": null
  },
  "parse_profile": {
    "chapter_count": 372,
    "volume_count": 1,
    "average_chapter_chars": 3534,
    "boundary_types": [
      "chinese_chapter_heading"
    ],
    "parser_warnings": []
  }
}
