{
  "source_id": "source-1199",
  "pipeline_version": "distillation-v1",
  "source_hash_sha256": "5506349bf53a2d2fdfabf13e25f3dbdc080f69b62ce65f70431ed98774a84a66",
  "source_format": "txt",
  "encoding": "gb18030",
  "title_key_hmac_sha256": "b7990594b280a981d2774feceb3f6d094d1f7eda004c2a46520699933350e5fd",
  "title_signal_source": "file_stem",
  "has_author_metadata": false,
  "language": null,
  "rights_status": "user_supplied_for_analysis",
  "redaction_policy": {
    "store_source_title_in_repo": false,
    "store_author_in_repo": false,
    "store_raw_text_in_repo": false
  },
  "dedupe": {
    "strategy": "private-title-key-hmac",
    "duplicate_of": null
  },
  "parse_profile": {
    "chapter_count": 751,
    "volume_count": 1,
    "average_chapter_chars": 2861,
    "boundary_types": [
      "chinese_chapter_heading"
    ],
    "parser_warnings": []
  }
}
