{
  "source_id": "source-0892",
  "pipeline_version": "distillation-v1",
  "source_hash_sha256": "d7a5022a61455b7b018e76170b943846c9999d95d0d2659096e40aa802792bd3",
  "source_format": "txt",
  "encoding": "gb18030",
  "title_key_hmac_sha256": "a4ab45890e02e8fc6b063e3abda0caf9b690da864f398f9ed56c06d0d3e355a5",
  "title_signal_source": "file_stem",
  "has_author_metadata": false,
  "language": null,
  "rights_status": "user_supplied_for_analysis",
  "redaction_policy": {
    "store_source_title_in_repo": false,
    "store_author_in_repo": false,
    "store_raw_text_in_repo": false
  },
  "dedupe": {
    "strategy": "private-title-key-hmac",
    "duplicate_of": null
  },
  "parse_profile": {
    "chapter_count": 201,
    "volume_count": 1,
    "average_chapter_chars": 6691,
    "boundary_types": [
      "fixed_size_fallback"
    ],
    "parser_warnings": [
      "No chapter headings matched; fell back to fixed-size anonymous chunks."
    ]
  }
}
