{
  "source_id": "source-1085",
  "pipeline_version": "distillation-v1",
  "source_hash_sha256": "6a17832f95d25dcf6616e4e3a0410e65093147684b72a1e3e67a0c5939088dc7",
  "source_format": "txt",
  "encoding": "gb18030",
  "title_key_hmac_sha256": "934013db88991b3369900d9cb2a072b595d5640e75617e8fe06e6f94c693de0c",
  "title_signal_source": "file_stem",
  "has_author_metadata": false,
  "language": null,
  "rights_status": "user_supplied_for_analysis",
  "redaction_policy": {
    "store_source_title_in_repo": false,
    "store_author_in_repo": false,
    "store_raw_text_in_repo": false
  },
  "dedupe": {
    "strategy": "private-title-key-hmac",
    "duplicate_of": null
  },
  "parse_profile": {
    "chapter_count": 1183,
    "volume_count": 1,
    "average_chapter_chars": 3806,
    "boundary_types": [
      "chinese_chapter_heading"
    ],
    "parser_warnings": []
  }
}
