{
  "source_id": "source-0995",
  "pipeline_version": "distillation-v1",
  "source_hash_sha256": "93ccece5cc75f08bd2d42b5662469f11d8cb09d7b3ce4b378c00bf250d529282",
  "source_format": "txt",
  "encoding": "gb18030",
  "title_key_hmac_sha256": "6dab8ee801c88e6fa2d2ec82153141c0059b9fb007ac1e8a3d42c5b9b88a9d65",
  "title_signal_source": "file_stem",
  "has_author_metadata": false,
  "language": null,
  "rights_status": "user_supplied_for_analysis",
  "redaction_policy": {
    "store_source_title_in_repo": false,
    "store_author_in_repo": false,
    "store_raw_text_in_repo": false
  },
  "dedupe": {
    "strategy": "private-title-key-hmac",
    "duplicate_of": null
  },
  "parse_profile": {
    "chapter_count": 828,
    "volume_count": 1,
    "average_chapter_chars": 3558,
    "boundary_types": [
      "chinese_chapter_heading"
    ],
    "parser_warnings": []
  }
}
