{
  "source_id": "source-1219",
  "pipeline_version": "distillation-v1",
  "source_hash_sha256": "77e47cee54e36799e79f70d4b3f326bb424670ae865b6c95a50ba78051e9b5b0",
  "source_format": "txt",
  "encoding": "gb18030",
  "title_key_hmac_sha256": "65c209cd3ad4e744560968a426027319d77bb6e71e681d84fab8d3654ee303fa",
  "title_signal_source": "file_stem",
  "has_author_metadata": false,
  "language": null,
  "rights_status": "user_supplied_for_analysis",
  "redaction_policy": {
    "store_source_title_in_repo": false,
    "store_author_in_repo": false,
    "store_raw_text_in_repo": false
  },
  "dedupe": {
    "strategy": "private-title-key-hmac",
    "duplicate_of": null
  },
  "parse_profile": {
    "chapter_count": 1312,
    "volume_count": 1,
    "average_chapter_chars": 2694,
    "boundary_types": [
      "chinese_chapter_heading"
    ],
    "parser_warnings": []
  }
}
