{
  "source_id": "source-0874",
  "pipeline_version": "distillation-v1",
  "source_hash_sha256": "62a8c9ddcca3ef33fb8aaa4d73551256272fb03dbdc63823006d703285b68aaa",
  "source_format": "txt",
  "encoding": "gb18030",
  "title_key_hmac_sha256": "7ac4e77d4dd51961e2899f671648ef02881183a46114406b30cc9c1c7be6da86",
  "title_signal_source": "file_stem",
  "has_author_metadata": false,
  "language": null,
  "rights_status": "user_supplied_for_analysis",
  "redaction_policy": {
    "store_source_title_in_repo": false,
    "store_author_in_repo": false,
    "store_raw_text_in_repo": false
  },
  "dedupe": {
    "strategy": "private-title-key-hmac",
    "duplicate_of": null
  },
  "parse_profile": {
    "chapter_count": 1034,
    "volume_count": 1,
    "average_chapter_chars": 3770,
    "boundary_types": [
      "chinese_chapter_heading"
    ],
    "parser_warnings": []
  }
}
