{
  "source_id": "source-0949",
  "pipeline_version": "distillation-v1",
  "source_hash_sha256": "a30e1b6b83c9075e76f55a6ebf1625494c70cd902a4f8c905bf90a3b5a608cd0",
  "source_format": "txt",
  "encoding": "gb18030",
  "title_key_hmac_sha256": "62a394dbea26a745c31673a62faefa3c54b2ae0896660ee74467cbe8a94c57a8",
  "title_signal_source": "file_stem",
  "has_author_metadata": false,
  "language": null,
  "rights_status": "user_supplied_for_analysis",
  "redaction_policy": {
    "store_source_title_in_repo": false,
    "store_author_in_repo": false,
    "store_raw_text_in_repo": false
  },
  "dedupe": {
    "strategy": "private-title-key-hmac",
    "duplicate_of": null
  },
  "parse_profile": {
    "chapter_count": 949,
    "volume_count": 1,
    "average_chapter_chars": 3281,
    "boundary_types": [
      "chinese_chapter_heading"
    ],
    "parser_warnings": []
  }
}
