{
  "source_id": "source-1045",
  "pipeline_version": "distillation-v1",
  "source_hash_sha256": "0921653ecf5bf80ddf4e29c1fdd3ed0f6c2c222a5ad53e7e118719ca8583929b",
  "source_format": "txt",
  "encoding": "gb18030",
  "title_key_hmac_sha256": "940b63b3e4c198817b9b43b9bb63f15384fc1c037f9c4ec9257c77d2fbf15c83",
  "title_signal_source": "file_stem",
  "has_author_metadata": false,
  "language": null,
  "rights_status": "user_supplied_for_analysis",
  "redaction_policy": {
    "store_source_title_in_repo": false,
    "store_author_in_repo": false,
    "store_raw_text_in_repo": false
  },
  "dedupe": {
    "strategy": "private-title-key-hmac",
    "duplicate_of": null
  },
  "parse_profile": {
    "chapter_count": 734,
    "volume_count": 1,
    "average_chapter_chars": 2885,
    "boundary_types": [
      "chinese_chapter_heading"
    ],
    "parser_warnings": []
  }
}
