{
  "source_id": "source-0984",
  "pipeline_version": "distillation-v1",
  "source_hash_sha256": "8da4d12b8e86899a6c7a0ab6be666c5d5ff8e193ce792abfc2de0294d1e8c9b1",
  "source_format": "txt",
  "encoding": "gb18030",
  "title_key_hmac_sha256": "2563aa2df3e5774fa03ce57149b78604f4121d285d4877f11904a4497877eb4a",
  "title_signal_source": "file_stem",
  "has_author_metadata": false,
  "language": null,
  "rights_status": "user_supplied_for_analysis",
  "redaction_policy": {
    "store_source_title_in_repo": false,
    "store_author_in_repo": false,
    "store_raw_text_in_repo": false
  },
  "dedupe": {
    "strategy": "private-title-key-hmac",
    "duplicate_of": null
  },
  "parse_profile": {
    "chapter_count": 1005,
    "volume_count": 1,
    "average_chapter_chars": 5390,
    "boundary_types": [
      "chinese_chapter_heading"
    ],
    "parser_warnings": []
  }
}
