{
  "source_id": "source-1036",
  "pipeline_version": "distillation-v1",
  "source_hash_sha256": "df199761e2b8ecbc9e61d13e607b48fbb9b8a2eb7d8338e88976037d704c1ad6",
  "source_format": "txt",
  "encoding": "gb18030",
  "title_key_hmac_sha256": "d42bfefd501151dfaeadd55105eb840eeb48e700837d3ed473d756d095e54bc4",
  "title_signal_source": "file_stem",
  "has_author_metadata": false,
  "language": null,
  "rights_status": "user_supplied_for_analysis",
  "redaction_policy": {
    "store_source_title_in_repo": false,
    "store_author_in_repo": false,
    "store_raw_text_in_repo": false
  },
  "dedupe": {
    "strategy": "private-title-key-hmac",
    "duplicate_of": null
  },
  "parse_profile": {
    "chapter_count": 964,
    "volume_count": 1,
    "average_chapter_chars": 4207,
    "boundary_types": [
      "chinese_chapter_heading"
    ],
    "parser_warnings": []
  }
}
