{
  "source_id": "source-1063",
  "pipeline_version": "distillation-v1",
  "source_hash_sha256": "3b8d65111fc7756491c4bbb9d1ce117750c98bdc6e7868512d4358fa84cff27b",
  "source_format": "txt",
  "encoding": "gb18030",
  "title_key_hmac_sha256": "76bb7dd7ee533736a768d96ee1e99710d1f7dde7bb368e1aac3d4d14c2d1510c",
  "title_signal_source": "file_stem",
  "has_author_metadata": false,
  "language": null,
  "rights_status": "user_supplied_for_analysis",
  "redaction_policy": {
    "store_source_title_in_repo": false,
    "store_author_in_repo": false,
    "store_raw_text_in_repo": false
  },
  "dedupe": {
    "strategy": "private-title-key-hmac",
    "duplicate_of": null
  },
  "parse_profile": {
    "chapter_count": 945,
    "volume_count": 1,
    "average_chapter_chars": 6393,
    "boundary_types": [
      "chinese_chapter_heading"
    ],
    "parser_warnings": []
  }
}
